Branch Code,Branch Name,Branch Complete Address,Contact,Fax,Email,ATM,Islamic Banking Hub,Islamic Banking Window,Latitude,Longitude
2005,Al Ain Branch,"Ground Floor, Building No. 2, Batha Al Hayer, Sanaiya, P.O. Box 1373, Al Ain, UAE.",+971 3 7803 392,Not Applicable,hbluae.2005@hbl.com,ATM,No,No,24.195707,55.761344
2096,Al Khail Mall Branch,"Al Khail Mall - Al Quoz - Al Quoz 4, Dubai, UAE.",+971 4 5971 120,Not Applicable,hbluae.2096@hbl.com,ATM,No,No,,
2012,Bur Dubai Branch,"Al Abbas Building, Ground Floor,Khalid Bin Al Waleed Road, Bur Dubai, P.O. Box 888, Dubai, UAE.",+971 4 3029 111,Not Applicable,hbluae.2012@hbl.com,ATM,No,No,25.25626,55.300988
2107,Jumeirah Branch,"Al Manara, Sheikh Zayed Road, P.O. Box 888, Dubai, UAE.",+971 4 3113 900,Not Applicable,hbluae.2107@hbl.com,ATM,No,No,,
2026,Sharjah Branch,"The Blue Tower, Al Majaz No. 3, Buhaira Corniche, P.O. Box 300, Sharjah, UAE.",+971 6 5112 711,Not Applicable,hbluae.2026@hbl.com,ATM,No,No,25.335115,55.375553
2101,"Shiekh Zayed Road Branch

","Omar Al Askari Building, Ground Floor,?P.O. Box 897, Abu Dhabi, UAE.",+971 2 6764 618,Not Applicable,hbluae.2101@hbl.com,ATM,No,No,24.491933,54.366958
